Title,Release Year,Genre,IMDB Rating,Metascore,Running Time (minutes),Rated,Domestic Revenue,Director,Stars,Summary,Universe
Batman Forever,1995,"Action, Adventure",5.4,51.0,121,PG,184030000.0,Joel Schumacher,"Val Kilmer, Tommy Lee Jones, Jim Carrey, Nicole Kidman","    Batman must battle former district attorney Harvey Dent, who is now Two-Face and Edward Nygma, The Riddler with help from an amorous psychologist and a young circus acrobat who becomes his sidekick, Robin.",DC
Batman Returns,1992,"Action, Crime, Fantasy",7.0,68.0,126,PG,162830000.0,Tim Burton,"Michael Keaton, Danny DeVito, Michelle Pfeiffer, Christopher Walken","    While Batman deals with a deformed man calling himself the Penguin wreaking havoc across Gotham with the help of a cruel businessman, a female employee of the latter becomes the Catwoman with her own vendetta.",DC
Batman,1989,"Action, Adventure",7.5,69.0,126,PG,251190000.0,Tim Burton,"Michael Keaton, Jack Nicholson, Kim Basinger, Robert Wuhl","    The Dark Knight of Gotham City begins his war on crime with his first major enemy being Jack Napier, a criminal who becomes the clownishly homicidal Joker.",DC
The Return of Swamp Thing,1989,"Action, Adventure, Comedy",4.7,39.0,89,PG,190000.0,Jim Wynorski,"Dick Durock, Heather Locklear, Louis Jourdan, Sarah Douglas","    In this tongue-in-cheek sequel, the benevolent bog creature falls for the vegetarian, plant-loving daughter of the evil scientist who created him.",DC
Superman IV: The Quest for Peace,1987,"Action, Adventure, Sci-Fi",3.7,24.0,90,PG,15680000.0,Sidney J. Furie,"Christopher Reeve, Gene Hackman, Margot Kidder, Jackie Cooper","    The Man of Steel crusades for nuclear disarmament and meets Lex Luthor's latest creation, Nuclear Man.",DC
Supergirl,1984,"Action, Adventure, Fantasy",4.4,42.0,124,PG,13600000.0,Jeannot Szwarc,"Helen Slater, Faye Dunaway, Peter O'Toole, Mia Farrow","    After losing a powerful orb, Kara Zor-El, Superman's cousin, comes to Earth to retrieve it and instead finds herself up against a wicked witch.",DC
Superman III,1983,"Action, Adventure, Comedy",5.0,44.0,125,PG,59950000.0,Richard Lester,"Christopher Reeve, Richard Pryor, Margot Kidder, Jackie Cooper",    Synthetic kryptonite laced with tar splits Superman in two: good Clark Kent and bad Man of Steel.,DC
Superman II,1980,"Action, Adventure, Sci-Fi",6.8,83.0,127,G,108190000.0,"Richard Lester, Richard Donner","Gene Hackman, Christopher Reeve, Margot Kidder, Ned Beatty","    Superman agrees to sacrifice his powers to start a relationship with Lois Lane, unaware that three Kryptonian criminals he inadvertently released are conquering Earth.",DC
Superman,1978,"Action, Adventure, Drama",7.3,80.0,143,PG,134220000.0,Richard Donner,"Christopher Reeve, Margot Kidder, Gene Hackman, Marlon Brando","    An alien orphan is sent from his dying planet to Earth, where he grows up to become his adoptive home's first and greatest superhero.",DC
