Title,Release Year,Genre,IMDB Rating,Metascore,Running Time (minutes),Rated,Domestic Revenue,Director,Stars,Summary,Universe
Spider-Man: Far from Home,2019,"Action, Adventure, Sci-Fi",7.5,69.0,129,PG,390530000.0,Jon Watts,"Tom Holland, Samuel L. Jackson, Jake Gyllenhaal, Marisa Tomei","    Following the events of Avengers: Endgame (2019), Spider-Man must step up to take on new threats in a world that has changed forever.",Marvel
Dark Phoenix,2019,"Action, Adventure, Sci-Fi",5.8,43.0,113,PG,65849999.99999999,Simon Kinberg,"James McAvoy, Michael Fassbender, Jennifer Lawrence, Nicholas Hoult","    Jean Grey begins to develop incredible powers that corrupt and turn her into a Dark Phoenix, causing the X-Men to decide if her life is worth more than all of humanity.",Marvel
Avengers: Endgame,2019,"Action, Adventure, Drama",8.4,78.0,181,PG,858370000.0,"Anthony Russo, Joe Russo","Robert Downey Jr., Chris Evans, Mark Ruffalo, Chris Hemsworth","    After the devastating events of Avengers: Infinity War (2018), the universe is in ruins. With the help of remaining allies, the Avengers assemble once more in order to reverse Thanos' actions and restore balance to the universe.",Marvel
Captain Marvel,2019,"Action, Adventure, Sci-Fi",6.9,64.0,123,PG,426830000.0,"Anna Boden, Ryan Fleck","Brie Larson, Samuel L. Jackson, Ben Mendelsohn, Jude Law",    Carol Danvers becomes one of the universe's most powerful heroes when Earth is caught in the middle of a galactic war between two alien races.,Marvel
Spider-Man: Into the Spider-Verse,2018,"Animation, Action, Adventure",8.4,87.0,117,PG,190240000.0,"Bob Persichetti, Peter Ramsey, Rodney Rothman","Shameik Moore, Jake Johnson, Hailee Steinfeld, Mahershala Ali","    Teen Miles Morales becomes the Spider-Man of his universe, and must join with five spider-powered individuals from other dimensions to stop a threat for all realities.",Marvel
Venom,2018,"Action, Adventure, Sci-Fi",6.7,35.0,112,14A,213520000.0,Ruben Fleischer,"Tom Hardy, Michelle Williams, Riz Ahmed, Scott Haze","    A failed reporter is bonded to an alien entity, one of many symbiotes who have invaded Earth. But the being takes a liking to Earth and decides to protect it.",Marvel
Ant-Man and the Wasp,2018,"Action, Adventure, Comedy",7.1,70.0,118,PG,216650000.0,Peyton Reed,"Paul Rudd, Evangeline Lilly, Michael Peña, Walton Goggins","    As Scott Lang balances being both a superhero and a father, Hope van Dyne and Dr. Hank Pym present an urgent new mission that finds the Ant-Man fighting alongside The Wasp to uncover secrets from their past.",Marvel
Deadpool 2,2018,"Action, Adventure, Comedy",7.7,66.0,119,14A,324590000.0,David Leitch,"Ryan Reynolds, Josh Brolin, Morena Baccarin, Julian Dennison","    Foul-mouthed mutant mercenary Wade Wilson (a.k.a. Deadpool), brings together a team of fellow mutant rogues to protect a young boy with supernatural abilities from the brutal, time-traveling cyborg Cable.",Marvel
Avengers: Infinity War,2018,"Action, Adventure, Sci-Fi",8.4,68.0,149,PG,678820000.0,"Anthony Russo, Joe Russo","Robert Downey Jr., Chris Hemsworth, Mark Ruffalo, Chris Evans",    The Avengers and their allies must be willing to sacrifice all in an attempt to defeat the powerful Thanos before his blitz of devastation and ruin puts an end to the universe.,Marvel
Black Panther,2018,"Action, Adventure, Sci-Fi",7.3,88.0,134,PG,700060000.0,Ryan Coogler,"Chadwick Boseman, Michael B. Jordan, Lupita Nyong'o, Danai Gurira","    T'Challa, heir to the hidden but advanced kingdom of Wakanda, must step forward to lead his people into a new future and must confront a challenger from his country's past.",Marvel
Thor: Ragnarok,2017,"Action, Adventure, Comedy",7.9,74.0,130,PG,315060000.0,Taika Waititi,"Chris Hemsworth, Tom Hiddleston, Cate Blanchett, Mark Ruffalo","    Imprisoned on the planet Sakaar, Thor must race against time to return to Asgard and stop Ragnarök, the destruction of his world, at the hands of the powerful and ruthless villain Hela.",Marvel
Spider-Man: Homecoming,2017,"Action, Adventure, Sci-Fi",7.4,73.0,133,PG,334200000.0,Jon Watts,"Tom Holland, Michael Keaton, Robert Downey Jr., Marisa Tomei","    Peter Parker balances his life as an ordinary high school student in Queens with his superhero alter-ego Spider-Man, and finds himself on the trail of a new menace prowling the skies of New York City.",Marvel
Guardians of the Galaxy Vol. 2,2017,"Action, Adventure, Comedy",7.6,67.0,136,PG,389810000.0,James Gunn,"Chris Pratt, Zoe Saldana, Dave Bautista, Vin Diesel","    The Guardians struggle to keep together as a team while dealing with their personal family issues, notably Star-Lord's encounter with his father the ambitious celestial being Ego.",Marvel
Logan,2017,"Action, Drama, Sci-Fi",8.1,77.0,137,18A,226280000.0,James Mangold,"Hugh Jackman, Patrick Stewart, Dafne Keen, Boyd Holbrook","    In a future where mutants are nearly extinct, an elderly and weary Logan leads a quiet life. But when Laura, a mutant child pursued by scientists, comes to him for help, he must get her to safety.",Marvel
Doctor Strange,2016,"Action, Adventure, Fantasy",7.5,72.0,115,PG,232640000.0,Scott Derrickson,"Benedict Cumberbatch, Chiwetel Ejiofor, Rachel McAdams, Benedict Wong","    While on a journey of physical and spiritual healing, a brilliant neurosurgeon is drawn into the world of the mystic arts.",Marvel
X-Men: Apocalypse,2016,"Action, Adventure, Sci-Fi",6.9,52.0,144,PG,155440000.0,Bryan Singer,"James McAvoy, Michael Fassbender, Jennifer Lawrence, Nicholas Hoult","    In the 1980s the X-Men must defeat an ancient all-powerful mutant, En Sabah Nur, who intends to thrive through bringing destruction to the world.",Marvel
Captain America: Civil War,2016,"Action, Adventure, Sci-Fi",7.8,75.0,147,PG,408080000.0,"Anthony Russo, Joe Russo","Chris Evans, Robert Downey Jr., Scarlett Johansson, Sebastian Stan",    Political involvement in the Avengers' affairs causes a rift between Captain America and Iron Man.,Marvel
Deadpool,2016,"Action, Adventure, Comedy",8.0,65.0,108,14A,363070000.0,Tim Miller,"Ryan Reynolds, Morena Baccarin, T.J. Miller, Ed Skrein","    A wisecracking mercenary gets experimented on and becomes immortal but ugly, and sets out to track down the man who ruined his looks.",Marvel
Fantastic Four,2015,"Action, Adventure, Sci-Fi",4.3,27.0,100,PG,56120000.0,"Josh Trank, Stephen E. Rivkin","Miles Teller, Kate Mara, Michael B. Jordan, Jamie Bell",    Four young outsiders teleport to an alternate and dangerous universe which alters their physical form in shocking ways. The four must learn to harness their new abilities and work together to save Earth from a former friend turned enemy.,Marvel
Ant-Man,2015,"Action, Adventure, Comedy",7.3,64.0,117,PG,180200000.0,Peyton Reed,"Paul Rudd, Michael Douglas, Corey Stoll, Evangeline Lilly","    Armed with a super-suit with the astonishing ability to shrink in scale but increase in strength, cat burglar Scott Lang must embrace his inner hero and help his mentor, Dr. Hank Pym, plan and pull off a heist that will save the world.",Marvel
Avengers: Age of Ultron,2015,"Action, Adventure, Sci-Fi",7.3,66.0,141,PG,459010000.0,Joss Whedon,"Robert Downey Jr., Chris Evans, Mark Ruffalo, Chris Hemsworth","    When Tony Stark and Bruce Banner try to jump-start a dormant peacekeeping program called Ultron, things go horribly wrong and it's up to Earth's mightiest heroes to stop the villainous Ultron from enacting his terrible plan.",Marvel
Big Hero 6,2014,"Animation, Action, Adventure",7.8,74.0,102,G,222530000.0,"Don Hall, Chris Williams","Ryan Potter, Scott Adsit, Jamie Chung, T.J. Miller","    The special bond develops between plus-sized inflatable robot Baymax, and prodigy Hiro Hamada. They team up with a group of friends to form a band of high-tech heroes.",Marvel
Guardians of the Galaxy,2014,"Action, Adventure, Comedy",8.0,76.0,121,PG,333180000.0,James Gunn,"Chris Pratt, Vin Diesel, Bradley Cooper, Zoe Saldana",    A group of intergalactic criminals must pull together to stop a fanatical warrior with plans to purge the universe.,Marvel
X-Men: Days of Future Past,2014,"Action, Adventure, Sci-Fi",7.9,75.0,132,PG,233920000.0,Bryan Singer,"Patrick Stewart, Ian McKellen, Hugh Jackman, James McAvoy",    The X-Men send Wolverine to the past in a desperate effort to change history and prevent an event that results in doom for both humans and mutants.,Marvel
The Amazing Spider-Man 2,2014,"Action, Adventure, Sci-Fi",6.6,53.0,142,PG,202850000.0,Marc Webb,"Andrew Garfield, Emma Stone, Jamie Foxx, Paul Giamatti","    When New York is put under siege by Oscorp, it is up to Spider-Man to save the city he swore to protect as well as his loved ones.",Marvel
Captain America: The Winter Soldier,2014,"Action, Adventure, Sci-Fi",7.7,70.0,136,PG,259769999.99999997,"Anthony Russo, Joe Russo","Chris Evans, Samuel L. Jackson, Scarlett Johansson, Robert Redford","    As Steve Rogers struggles to embrace his role in the modern world, he teams up with a fellow Avenger and S.H.I.E.L.D agent, Black Widow, to battle a new threat from history: an assassin known as the Winter Soldier.",Marvel
Thor: The Dark World,2013,"Action, Adventure, Fantasy",6.9,54.0,112,PG,206360000.0,Alan Taylor,"Chris Hemsworth, Natalie Portman, Tom Hiddleston, Stellan Skarsgård","    When the Dark Elves attempt to plunge the universe into darkness, Thor must embark on a perilous and personal journey that will reunite him with doctor Jane Foster.",Marvel
The Wolverine,2013,"Action, Adventure, Sci-Fi",6.7,61.0,126,14A,132560000.0,James Mangold,"Hugh Jackman, Will Yun Lee, Tao Okamoto, Rila Fukushima","    Wolverine comes to Japan to meet an old friend whose life he saved years ago, and gets embroiled in a conspiracy involving yakuza and mutants.",Marvel
Iron Man Three,2013,"Action, Adventure, Sci-Fi",7.2,62.0,130,PG,409010000.0,Shane Black,"Robert Downey Jr., Guy Pearce, Gwyneth Paltrow, Don Cheadle","    When Tony Stark's world is torn apart by a formidable terrorist called the Mandarin, he starts an odyssey of rebuilding and retribution.",Marvel
The Amazing Spider-Man,2012,"Action, Adventure, Sci-Fi",6.9,66.0,136,PG,262029999.99999997,Marc Webb,"Andrew Garfield, Emma Stone, Rhys Ifans, Irrfan Khan","    After Peter Parker is bitten by a genetically altered spider, he gains newfound, spider-like powers and ventures out to save the city from the machinations of a mysterious reptilian foe.",Marvel
The Avengers,2012,"Action, Adventure, Sci-Fi",8.0,69.0,143,PG,623280000.0,Joss Whedon,"Robert Downey Jr., Chris Evans, Scarlett Johansson, Jeremy Renner",    Earth's mightiest heroes must come together and learn to fight as a team if they are going to stop the mischievous Loki and his alien army from enslaving humanity.,Marvel
Ghost Rider: Spirit of Vengeance,2011,"Action, Fantasy, Thriller",4.3,34.0,96,14A,51770000.0,"Mark Neveldine, Brian Taylor","Nicolas Cage, Ciarán Hinds, Idris Elba, Violante Placido","    Johnny Blaze, tortured by the Ghost Rider's curse, gets a chance of redemption through protecting the Devil's son, whose father is pursuing him.",Marvel
Captain America: The First Avenger,2011,"Action, Adventure, Sci-Fi",6.9,66.0,124,PG,176650000.0,Joe Johnston,"Chris Evans, Hugo Weaving, Samuel L. Jackson, Hayley Atwell","    Steve Rogers, a rejected military soldier, transforms into Captain America after taking a dose of a ""Super-Soldier serum"". But being Captain America comes at a price as he attempts to take down a war monger and a terrorist organization.",Marvel
X: First Class,2011,"Action, Adventure, Sci-Fi",7.7,65.0,131,PG,146410000.0,Matthew Vaughn,"James McAvoy, Michael Fassbender, Jennifer Lawrence, Kevin Bacon","    In the 1960s, superpowered humans Charles Xavier and Erik Lensherr work together to find others like them, but Erik's vengeful pursuit of an ambitious mutant who ruined his life causes a schism to divide them.",Marvel
Thor,2011,"Action, Adventure, Fantasy",7.0,57.0,115,PG,181030000.0,Kenneth Branagh,"Chris Hemsworth, Anthony Hopkins, Natalie Portman, Tom Hiddleston","    The powerful but arrogant god Thor is cast out of Asgard to live amongst humans in Midgard (Earth), where he soon becomes one of their finest defenders.",Marvel
Iron Man 2,2010,"Action, Adventure, Sci-Fi",7.0,57.0,124,PG,312430000.0,Jon Favreau,"Robert Downey Jr., Mickey Rourke, Gwyneth Paltrow, Don Cheadle","    With the world now aware of his identity as Iron Man, Tony Stark must contend with both his declining health and a vengeful mad man with ties to his father's legacy.",Marvel
X-Men Origins: Wolverine,2009,"Action, Adventure, Sci-Fi",6.6,40.0,107,14A,179880000.0,Gavin Hood,"Hugh Jackman, Liev Schreiber, Ryan Reynolds, Danny Huston","    The early years of James Logan, featuring his rivalry with his brother Victor Creed, his service in the special forces team Weapon X, and his experimentation into the metal-lined mutant Wolverine.",Marvel
Punisher: War Zone,2008,"Action, Crime, Drama",5.9,30.0,103,16+,7950000.0,Lexi Alexander,"Ray Stevenson, Dominic West, Julie Benz, Doug Hutchison","    Frank Castle, known as the Punisher, ruthlessly demolishes organized crime, but it starts an even bigger war.",Marvel
The Incredible Hulk,2008,"Action, Adventure, Sci-Fi",6.7,61.0,112,PG,134520000.0,Louis Leterrier,"Edward Norton, Liv Tyler, Tim Roth, William Hurt","    Bruce Banner, a scientist on the run from the U.S. Government, must find a cure for the monster he turns into whenever he loses his temper.",Marvel
Iron Man,2008,"Action, Adventure, Sci-Fi",7.9,79.0,126,PG,318410000.0,Jon Favreau,"Robert Downey Jr., Gwyneth Paltrow, Terrence Howard, Jeff Bridges","    After being held captive in an Afghan cave, billionaire engineer Tony Stark creates a unique weaponized suit of armor to fight evil.",Marvel
4: Rise of the Silver Surfer,2007,"Action, Adventure, Fantasy",5.6,45.0,92,PG,131919999.99999999,Tim Story,"Ioan Gruffudd, Jessica Alba, Chris Evans, Michael Chiklis",    The Fantastic Four learn that they aren't the only super-powered beings in the universe when they square off against the powerful Silver Surfer and the planet-eating Galactus.,Marvel
Spider-Man 3,2007,"Action, Adventure, Sci-Fi",6.2,59.0,139,PG,336530000.0,Sam Raimi,"Tobey Maguire, Kirsten Dunst, Topher Grace, Thomas Haden Church","    A strange black entity from another world bonds with Peter Parker and causes inner turmoil as he contends with new villains, temptations, and revenge.",Marvel
Ghost Rider,2007,"Action, Fantasy, Thriller",5.2,35.0,110,G,115800000.0,Mark Steven Johnson,"Nicolas Cage, Eva Mendes, Sam Elliott, Matt Long","    When motorcycle rider Johnny Blaze sells his soul to the Devil to save his father's life, he is transformed into the Ghost Rider, the Devil's own bounty hunter, and is sent to hunt down sinners.",Marvel
X-Men: The Last Stand,2006,"Action, Adventure, Sci-Fi",6.7,58.0,104,PG,234360000.0,Brett Ratner,"Patrick Stewart, Hugh Jackman, Halle Berry, Famke Janssen","    The human government develops a cure for mutations, and Jean Gray becomes a darker uncontrollable persona called the Phoenix who allies with Magneto, causing escalation into an all-out battle for the X-Men.",Marvel
Fantastic Four,2005,"Action, Adventure, Fantasy",5.7,40.0,106,PG,154700000.0,Tim Story,"Ioan Gruffudd, Michael Chiklis, Chris Evans, Jessica Alba","    A group of astronauts gain superpowers after a cosmic radiation exposure and must use them to oppose the plans of their enemy, Doctor Victor Von Doom.",Marvel
Elektra,2005,"Action, Adventure, Crime",4.7,34.0,97,14A,24410000.0,Rob Bowman,"Jennifer Garner, Goran Visnjic, Will Yun Lee, Kirsten Zien","    Elektra the warrior survives a near-death experience, becomes an assassin-for-hire, and tries to protect her two latest targets, a single father and his young daughter, from a group of supernatural assassins.",Marvel
Blade: Trinity,2004,"Action, Adventure, Fantasy",5.9,38.0,113,18A,52410000.0,David S. Goyer,"Wesley Snipes, Kris Kristofferson, Parker Posey, Ryan Reynolds","    Blade, now a wanted man by the FBI, must join forces with the Nightstalkers to face his most challenging enemy yet: Dracula.",Marvel
Spider-Man 2,2004,"Action, Adventure, Sci-Fi",7.3,83.0,127,PG,373590000.0,Sam Raimi,"Tobey Maguire, Kirsten Dunst, Alfred Molina, James Franco",    Peter Parker is beset with troubles in his failing personal life as he battles a brilliant scientist named Doctor Otto Octavius.,Marvel
The Punisher,2004,"Action, Crime, Drama",6.4,33.0,124,16+,33680000.0,Jonathan Hensleigh,"Thomas Jane, John Travolta, Samantha Mathis, Laura Harring",    An undercover FBI agent becomes a vigilante assassin and sets out to unleash his wrath upon the corrupt businessman who slaughtered his entire family at a reunion.,Marvel
Hulk,2003,"Action, Sci-Fi",5.6,54.0,138,PG,132180000.0,Ang Lee,"Eric Bana, Jennifer Connelly, Sam Elliott, Josh Lucas","    Bruce Banner, a genetics researcher with a tragic past, suffers an accident that causes him to transform into a raging green monster when he gets angry.",Marvel
X2,2003,"Action, Adventure, Sci-Fi",7.4,68.0,134,PG,214950000.0,Bryan Singer,"Patrick Stewart, Hugh Jackman, Halle Berry, Ian McKellen","    When anti-mutant Colonel William Stryker kidnaps Professor X and attacks his school, the X-Men must ally with their archenemy Magneto to stop him.",Marvel
Daredevil,2003,"Action, Crime",5.3,42.0,103,14A,102540000.0,Mark Steven Johnson,"Ben Affleck, Jennifer Garner, Colin Farrell, Michael Clarke Duncan",    A man blinded by toxic waste which also enhanced his remaining senses fights crime as an acrobatic martial arts superhero.,Marvel
Spider-Man,2002,"Action, Adventure, Sci-Fi",7.3,73.0,121,PG,403710000.0,Sam Raimi,"Tobey Maguire, Kirsten Dunst, Willem Dafoe, James Franco","    When bitten by a genetically modified spider, a nerdy, shy, and awkward high school student gains spider-like abilities that he eventually must use to fight evil as a superhero after tragedy befalls his family.",Marvel
Blade II,2002,"Action, Fantasy, Horror",6.7,52.0,117,16+,82350000.0,Guillermo del Toro,"Wesley Snipes, Kris Kristofferson, Ron Perlman, Leonor Varela","    Blade forms an uneasy alliance with the vampire council in order to combat the Reapers, who are feeding on vampires.",Marvel
X-Men,2000,"Action, Adventure, Sci-Fi",7.4,64.0,104,PG,157300000.0,Bryan Singer,"Patrick Stewart, Hugh Jackman, Ian McKellen, Famke Janssen","    In a world where mutants (evolved super-powered humans) exist and are discriminated against, two groups form for an inevitable clash: the supremacist Brotherhood, and the pacifist X-Men.",Marvel
Blade,1998,"Action, Horror, Sci-Fi",7.1,45.0,120,16+,70090000.0,Stephen Norrington,"Wesley Snipes, Stephen Dorff, Kris Kristofferson, N'Bushe Wright","    A half-vampire, half-mortal man becomes a protector of the mortal race, while slaying evil vampires.",Marvel
Howard the Duck,1986,"Action, Adventure, Comedy",4.7,28.0,110,PG,16300000.0,Willard Huyck,"Lea Thompson, Jeffrey Jones, Tim Robbins, Ed Gale",    A sarcastic humanoid duck is pulled from his homeworld to Earth where he must stop an alien invasion with the help of a nerdy scientist and a struggling female rock singer.,Marvel
Birds of Prey: And the Fantabulous Emancipation of One Harley Quinn,2020,"Action, Adventure, Crime",6.1,60.0,109,14A,84160000.0,Cathy Yan,"Margot Robbie, Rosie Perez, Mary Elizabeth Winstead, Jurnee Smollett","    After splitting with the Joker, Harley Quinn joins superheroes Black Canary, Huntress and Renee Montoya to save a young girl from an evil crime lord.",DC
Joker,2019,"Crime, Drama, Thriller",8.5,59.0,122,14A,335450000.0,Todd Phillips,"Joaquin Phoenix, Robert De Niro, Zazie Beetz, Frances Conroy","    In Gotham City, mentally troubled comedian Arthur Fleck is disregarded and mistreated by society. He then embarks on a downward spiral of revolution and bloody crime. This path brings him face-to-face with his alter-ego: the Joker.",DC
Shazam!,2019,"Action, Adventure, Comedy",7.1,71.0,132,PG,140370000.0,David F. Sandberg,"Zachary Levi, Mark Strong, Asher Angel, Jack Dylan Grazer",    A newly fostered young boy in search of his mother instead finds unexpected super powers and soon gains a powerful enemy.,DC
Aquaman,2018,"Action, Adventure, Fantasy",6.9,55.0,143,PG,335060000.0,James Wan,"Jason Momoa, Amber Heard, Willem Dafoe, Patrick Wilson","    Arthur Curry, the human-born heir to the underwater kingdom of Atlantis, goes on a quest to prevent a war between the worlds of ocean and land.",DC
Teen Titans Go! To the Movies,2018,"Animation, Action, Adventure",6.8,69.0,84,PG,29560000.0,"Aaron Horvath, Peter Rida Michail","Greg Cipes, Scott Menville, Khary Payton, Tara Strong",    A villain's maniacal plan for world domination sidetracks five teenage superheroes who dream of Hollywood stardom.,DC
Justice League,2017,"Action, Adventure, Fantasy",6.3,45.0,120,PG,229020000.0,Zack Snyder,"Ben Affleck, Gal Gadot, Jason Momoa, Ezra Miller","    Fueled by his restored faith in humanity and inspired by Superman's selfless act, Bruce Wayne enlists the help of his new-found ally, Diana Prince, to face an even greater enemy.",DC
Wonder Woman,2017,"Action, Adventure, Fantasy",7.4,76.0,141,PG,412560000.0,Patty Jenkins,"Gal Gadot, Chris Pine, Robin Wright, Lucy Davis","    When a pilot crashes and tells of conflict in the outside world, Diana, an Amazonian warrior in training, leaves home to fight a war, discovering her full powers and true destiny.",DC
Suicide Squad,2016,"Action, Adventure, Fantasy",6.0,40.0,123,PG,325100000.0,David Ayer,"Will Smith, Jared Leto, Margot Robbie, Viola Davis",    A secret government agency recruits some of the most dangerous incarcerated super-villains to form a defensive task force. Their first mission: save the world from the apocalypse.,DC
Batman v Superman: Dawn of Justice,2016,"Action, Adventure, Sci-Fi",6.4,44.0,152,PG,330360000.0,Zack Snyder,"Ben Affleck, Henry Cavill, Amy Adams, Jesse Eisenberg","    Fearing that the actions of Superman are left unchecked, Batman takes on the Man of Steel, while the world wrestles with what kind of a hero it really needs.",DC
Man of Steel,2013,"Action, Adventure, Sci-Fi",7.0,55.0,143,PG,291050000.0,Zack Snyder,"Henry Cavill, Amy Adams, Michael Shannon, Diane Lane","    An alien child is evacuated from his dying world and sent to Earth to live among humans. His peace is threatened, when other survivors of his home planet invade Earth.",DC
The Dark Knight Rises,2012,"Action, Adventure",8.4,78.0,164,14A,448140000.0,Christopher Nolan,"Christian Bale, Tom Hardy, Anne Hathaway, Gary Oldman","    Eight years after the Joker's reign of anarchy, Batman, with the help of the enigmatic Catwoman, is forced from his exile to save Gotham City from the brutal guerrilla terrorist Bane.",DC
Green Lantern,2011,"Action, Adventure, Sci-Fi",5.5,39.0,114,PG,116600000.0,Martin Campbell,"Ryan Reynolds, Blake Lively, Peter Sarsgaard, Mark Strong","    Reckless test pilot Hal Jordan is granted an alien ring that bestows him with otherworldly powers that inducts him into an intergalactic police force, the Green Lantern Corps.",DC
Jonah Hex,2010,"Action, Drama, Fantasy",4.7,33.0,81,14A,10540000.0,Jimmy Hayward,"Josh Brolin, Megan Fox, John Malkovich, Michael Fassbender","    The U.S. military makes a scarred bounty hunter with warrants on his own head an offer he cannot refuse: in exchange for his freedom, he must stop a terrorist who is ready to unleash Hell on Earth.",DC
Watchmen,2009,"Action, Drama, Mystery",7.6,56.0,162,18A,107510000.0,Zack Snyder,"Jackie Earle Haley, Patrick Wilson, Carla Gugino, Malin Akerman","    In 1985 where former superheroes exist, the murder of a colleague sends active vigilante Rorschach into his own sprawling investigation, uncovering something that could completely change the course of history as we know it.",DC
The Dark Knight,2008,"Action, Crime, Drama",9.0,84.0,152,PG,534860000.0,Christopher Nolan,"Christian Bale, Heath Ledger, Aaron Eckhart, Michael Caine","    When the menace known as the Joker wreaks havoc and chaos on the people of Gotham, Batman must accept one of the greatest psychological and physical tests of his ability to fight injustice.",DC
Superman Returns,2006,"Action, Sci-Fi",6.0,72.0,154,PG,200080000.0,Bryan Singer,"Brandon Routh, Kevin Spacey, Kate Bosworth, James Marsden","    Superman returns to Earth after spending five years in space examining his homeworld Krypton. But he finds things have changed while he was gone, and he must once again prove himself important to the world.",DC
Batman Begins,2005,"Action, Adventure",8.2,70.0,140,PG,206850000.0,Christopher Nolan,"Christian Bale, Michael Caine, Ken Watanabe, Liam Neeson","    After training with his mentor, Batman begins his fight to free crime-ridden Gotham City from corruption.",DC
Constantine,2005,"Action, Fantasy, Horror",7.0,50.0,121,14A,75980000.0,Francis Lawrence,"Keanu Reeves, Rachel Weisz, Djimon Hounsou, Shia LaBeouf","    Supernatural exorcist and demonologist John Constantine helps a policewoman prove her sister's death was not a suicide, but something more.",DC
Catwoman,2004,"Action, Crime, Fantasy",3.4,27.0,104,PG,40200000.0,Pitof,"Halle Berry, Sharon Stone, Benjamin Bratt, Lambert Wilson","    A shy woman, endowed with the speed, reflexes, and senses of a cat, walks a thin line between criminal and hero, even as a detective doggedly pursues her, fascinated by both of her personas.",DC
Batman & Robin,1997,"Action, Sci-Fi",3.8,28.0,125,PG,107330000.0,Joel Schumacher,"Arnold Schwarzenegger, George Clooney, Chris O'Donnell, Uma Thurman",    Batman and Robin try to keep their relationship together even as they must stop Mr. Freeze and Poison Ivy from freezing Gotham City.,DC
